<?xml version="1.0" encoding="UTF-8"?>
<!DOCTYPE level SYSTEM "level.dtd">
<level>
    <name>Level Nine</name>
    <difficulty>hard</difficulty>
    <ball_speed>13</ball_speed>
    <next>level_1.xml</next>
    <bricks> 
        <row>
            <column color="white">1</column>
            <column color="white">1</column>
            <column color="white">1</column>
            <column color="white">1</column>
            <column color="white">1</column>
            <column color="white">1</column>
            <column color="white">1</column>
            <column color="white">1</column>
            <column color="white">1</column>
            <column color="white">1</column>
        </row>
        <row>
            <column color="white">1</column>
            <column color="white">1</column>
            <column color="white">1</column>
            <column color="white">1</column>
            <column color="white">1</column>
            <column color="white">1</column>
            <column color="white">1</column>
            <column color="white">1</column>
            <column color="white">1</column>
            <column color="white">1</column>
        </row>
        <row>
            <column color="white">1</column>
            <column color="white">1</column>
            <column color="white">1</column>
            <column color="white">1</column>
            <column color="white">1</column>
            <column color="white">1</column>
            <column color="white">1</column>
            <column color="white">1</column>
            <column color="white">1</column>
            <column color="white">1</column>
        </row>
        <row>
            <column color="white">1</column>
            <column color="white">1</column>
            <column color="white">1</column>
            <column color="white">1</column>
            <column color="white">1</column>
            <column color="white">1</column>
            <column color="white">1</column>
            <column color="white">1</column>
            <column color="white">1</column>
            <column color="white">1</column>
        </row>
        <row>
            <column color="white">1</column>
            <column color="white">1</column>
            <column color="white">1</column>
            <column color="white">1</column>
            <column color="white">1</column>
            <column color="white">1</column>
            <column color="white">1</column>
            <column color="white">1</column>
            <column color="white">1</column>
            <column color="white">1</column>
        </row>
        <row>
            <column color="white">1</column>
            <column color="white">1</column>
            <column color="white">1</column>
            <column color="white">1</column>
            <column color="white">1</column>
            <column color="white">1</column>
            <column color="white">1</column>
            <column color="white">1</column>
            <column color="white">1</column>
            <column color="white">1</column>
        </row>
        <row>
            <column color="white">1</column>
            <column color="white">1</column>
            <column color="white">1</column>
            <column color="white">1</column>
            <column color="white">1</column>
            <column color="white">1</column>
            <column color="white">1</column>
            <column color="white">1</column>
            <column color="white">1</column>
            <column color="white">1</column>
        </row>
        <row>
            <column color="white">1</column>
            <column color="white">1</column>
            <column color="white">1</column>
            <column color="white">1</column>
            <column color="white">1</column>
            <column color="white">1</column>
            <column color="white">1</column>
            <column color="white">1</column>
            <column color="white">1</column>
            <column color="white">1</column>
        </row>
        <row>
            <column color="white">1</column>
            <column color="white">1</column>
            <column color="white">1</column>
            <column color="white">1</column>
            <column color="white">1</column>
            <column color="white">1</column>
            <column color="white">1</column>
            <column color="white">1</column>
            <column color="white">1</column>
            <column color="white">1</column>
        </row>
        <row>
            <column color="white">1</column>
            <column color="white">1</column>
            <column color="white">1</column>
            <column color="white">1</column>
            <column color="white">1</column>
            <column color="white">1</column>
            <column color="white">1</column>
            <column color="white">1</column>
            <column color="white">1</column>
            <column color="white">1</column>
        </row>
    </bricks>        
</level>
