<?xml version="1.0" encoding="UTF-8"?>
<!DOCTYPE level SYSTEM "level.dtd">
<level>
    <name>Level Eight</name>
    <difficulty>hard</difficulty>
    <ball_speed>12</ball_speed>
    <next>level_9.xml</next>
    <bricks>
        <row>
            <column color="yellow">1</column>
            <column color="yellow">1</column>
            <column color="yellow">1</column>
            <column color="yellow">1</column>
            <column color="yellow">1</column>
            <column color="yellow">1</column>
            <column color="yellow">1</column>
            <column color="yellow">1</column>
            <column color="yellow">1</column>
            <column color="yellow">1</column>
        </row>
        <row>
            <column color="yellow">1</column>
            <column color="yellow">1</column>
            <column color="yellow">1</column>
            <column color="yellow">1</column>
            <column color="yellow">1</column>
            <column color="yellow">1</column>
            <column color="yellow">1</column>
            <column color="yellow">1</column>
            <column color="yellow">1</column>
            <column color="yellow">1</column>
        </row>
        <row>
            <column color="yellow">1</column>
            <column color="yellow">1</column>
            <column color="yellow">1</column>
            <column color="yellow">1</column>
            <column color="yellow">1</column>
            <column color="yellow">1</column>
            <column color="yellow">1</column>
            <column color="yellow">1</column>
            <column color="yellow">1</column>
            <column color="yellow">1</column>
        </row>
        <row>
            <column color="yellow">1</column>
            <column color="yellow">1</column>
            <column color="yellow">1</column>
            <column color="yellow">1</column>
            <column color="yellow">1</column>
            <column color="yellow">1</column>
            <column color="yellow">1</column>
            <column color="yellow">1</column>
            <column color="yellow">1</column>
            <column color="yellow">1</column>
        </row>
        <row>
            <column color="yellow">1</column>
            <column color="yellow">1</column>
            <column color="yellow">1</column>
            <column color="yellow">1</column>
            <column color="yellow">1</column>
            <column color="yellow">1</column>
            <column color="yellow">1</column>
            <column color="yellow">1</column>
            <column color="yellow">1</column>
            <column color="yellow">1</column>
        </row>
        <row>
            <column color="yellow">1</column>
            <column color="yellow">1</column>
            <column color="yellow">1</column>
            <column color="yellow">1</column>
            <column color="yellow">1</column>
            <column color="yellow">1</column>
            <column color="yellow">1</column>
            <column color="yellow">1</column>
            <column color="yellow">1</column>
            <column color="yellow">1</column>
        </row>
        <row>
            <column color="yellow">1</column>
            <column color="yellow">1</column>
            <column color="yellow">1</column>
            <column color="yellow">1</column>
            <column color="yellow">1</column>
            <column color="yellow">1</column>
            <column color="yellow">1</column>
            <column color="yellow">1</column>
            <column color="yellow">1</column>
            <column color="yellow">1</column>
        </row>
        <row>
            <column color="yellow">1</column>
            <column color="yellow">1</column>
            <column color="yellow">1</column>
            <column color="yellow">1</column>
            <column color="yellow">1</column>
            <column color="yellow">1</column>
            <column color="yellow">1</column>
            <column color="yellow">1</column>
            <column color="yellow">1</column>
            <column color="yellow">1</column>
        </row>
        <row>
            <column color="yellow">1</column>
            <column color="yellow">1</column>
            <column color="yellow">1</column>
            <column color="yellow">1</column>
            <column color="yellow">1</column>
            <column color="yellow">1</column>
            <column color="yellow">1</column>
            <column color="yellow">1</column>
            <column color="yellow">1</column>
            <column color="yellow">1</column>
        </row>
        <row>
            <column color="yellow">1</column>
            <column color="yellow">1</column>
            <column color="yellow">1</column>
            <column color="yellow">1</column>
            <column color="yellow">1</column>
            <column color="yellow">1</column>
            <column color="yellow">1</column>
            <column color="yellow">1</column>
            <column color="yellow">1</column>
            <column color="yellow">1</column>
        </row>
    </bricks>        
</level>
