<?xml version="1.0" encoding="UTF-8"?>
<!DOCTYPE level SYSTEM "level.dtd">
<level>
    <name>Level One</name>
    <difficulty>easy</difficulty>
    <ball_speed>5</ball_speed>
    <next>level_2.xml</next>
    <bricks>
        <row>
            <column color="red">1</column>
            <column color="red">1</column>
            <column color="red">1</column>
            <column color="red">1</column>
            <column color="red">1</column>
            <column color="red">1</column>
            <column color="red">1</column>
            <column color="red">1</column>
            <column color="red">1</column>
            <column color="red">1</column>
        </row>
        <row>
            <column color="red">1</column>
            <column color="red">1</column>
            <column color="red">1</column>
            <column color="red">1</column>
            <column color="red">1</column>
            <column color="red">1</column>
            <column color="red">1</column>
            <column color="red">1</column>
            <column color="red">1</column>
            <column color="red">1</column>
        </row>
    </bricks>        
</level>
