<?xml version="1.0" encoding="UTF-8"?>
<!DOCTYPE level SYSTEM "level.dtd">
<level>
    <name>Level Three</name>
    <difficulty>easy</difficulty>
    <ball_speed>7</ball_speed>
    <next>level_4.xml</next>
    <bricks>
        <row>
            <column color="green">1</column>
            <column color="green">1</column>
            <column color="green">1</column>
            <column color="green">1</column>
            <column color="green">1</column>
            <column color="green">1</column>
            <column color="green">1</column>
            <column color="green">1</column>
            <column color="green">1</column>
            <column color="green">1</column>
        </row>
        <row>
            <column color="green">1</column>
            <column color="green">1</column>
            <column color="green">1</column>
            <column color="green">1</column>
            <column color="green">1</column>
            <column color="green">1</column>
            <column color="green">1</column>
            <column color="green">1</column>
            <column color="green">1</column>
            <column color="green">1</column>
        </row>
        <row>
            <column color="green">1</column>
            <column color="green">1</column>
            <column color="green">1</column>
            <column color="green">1</column>
            <column color="green">1</column>
            <column color="green">1</column>
            <column color="green">1</column>
            <column color="green">1</column>
            <column color="green">1</column>
            <column color="green">1</column>
        </row>
        <row>
            <column color="green">1</column>
            <column color="green">1</column>
            <column color="green">1</column>
            <column color="green">1</column>
            <column color="green">1</column>
            <column color="green">1</column>
            <column color="green">1</column>
            <column color="green">1</column>
            <column color="green">1</column>
            <column color="green">1</column>
        </row>
        <row>
            <column color="green">1</column>
            <column color="green">1</column>
            <column color="green">1</column>
            <column color="green">1</column>
            <column color="green">1</column>
            <column color="green">1</column>
            <column color="green">1</column>
            <column color="green">1</column>
            <column color="green">1</column>
            <column color="green">1</column>
        </row>
        <row>
            <column color="green">1</column>
            <column color="green">1</column>
            <column color="green">1</column>
            <column color="green">1</column>
            <column color="green">1</column>
            <column color="green">1</column>
            <column color="green">1</column>
            <column color="green">1</column>
            <column color="green">1</column>
            <column color="green">1</column>
        </row>
    </bricks>        
</level>
