<?xml version="1.0" encoding="UTF-8"?>
<!DOCTYPE level SYSTEM "level.dtd">
<level>
    <name>Level Seven</name>
    <difficulty>hard</difficulty>
    <ball_speed>11</ball_speed>
    <next>level_8.xml</next>
    <bricks>
        <row>
            <column>tan</column>
            <column>tan</column>
            <column>tan</column>
            <column>tan</column>
            <column>tan</column>
            <column>tan</column>
            <column>tan</column>
            <column>tan</column>
            <column>tan</column>
            <column>tan</column>
        </row>
        <row>
            <column>tan</column>
            <column>tan</column>
            <column>tan</column>
            <column>tan</column>
            <column>tan</column>
            <column>tan</column>
            <column>tan</column>
            <column>tan</column>
            <column>tan</column>
            <column>tan</column>
        </row>
        <row>
            <column>tan</column>
            <column>tan</column>
            <column>tan</column>
            <column>tan</column>
            <column>tan</column>
            <column>tan</column>
            <column>tan</column>
            <column>tan</column>
            <column>tan</column>
            <column>tan</column>
        </row>
        <row>
            <column>tan</column>
            <column>tan</column>
            <column>tan</column>
            <column>tan</column>
            <column>tan</column>
            <column>tan</column>
            <column>tan</column>
            <column>tan</column>
            <column>tan</column>
            <column>tan</column>
        </row>
        <row>
            <column>tan</column>
            <column>tan</column>
            <column>tan</column>
            <column>tan</column>
            <column>tan</column>
            <column>tan</column>
            <column>tan</column>
            <column>tan</column>
            <column>tan</column>
            <column>tan</column>
        </row>
        <row>
            <column>tan</column>
            <column>tan</column>
            <column>tan</column>
            <column>tan</column>
            <column>tan</column>
            <column>tan</column>
            <column>tan</column>
            <column>tan</column>
            <column>tan</column>
            <column>tan</column>
        </row>
        <row>
            <column>tan</column>
            <column>tan</column>
            <column>tan</column>
            <column>tan</column>
            <column>tan</column>
            <column>tan</column>
            <column>tan</column>
            <column>tan</column>
            <column>tan</column>
            <column>tan</column>
        </row>
        <row>
            <column>tan</column>
            <column>tan</column>
            <column>tan</column>
            <column>tan</column>
            <column>tan</column>
            <column>tan</column>
            <column>tan</column>
            <column>tan</column>
            <column>tan</column>
            <column>tan</column>
        </row>
        <row>
            <column>tan</column>
            <column>tan</column>
            <column>tan</column>
            <column>tan</column>
            <column>tan</column>
            <column>tan</column>
            <column>tan</column>
            <column>tan</column>
            <column>tan</column>
            <column>tan</column>
        </row>
        <row>
            <column>tan</column>
            <column>tan</column>
            <column>tan</column>
            <column>tan</column>
            <column>tan</column>
            <column>tan</column>
            <column>tan</column>
            <column>tan</column>
            <column>tan</column>
            <column>tan</column>
        </row>
    </bricks>        
</level>
